{
  "report_year": 2026,
  "title": "2026 Annual Report of the United States Commission on International Religious Freedom",
  "publication_date": "2026-04-20",
  "cpc_countries": [
    "China",
    "Iran"
  ],
  "swl_countries": [
    "China",
    "Iran"
  ],
  "epc_entities": [
    "China",
    "Iran",
    "Russia"
  ],
  "countries_assessed": 38,
  "report_url": "https://www.uscirf.gov/countries/2026-annual-report",
  "pdf_url": "https://www.uscirf.gov/countries/2026-annual-report",
  "key_themes": [
    "China",
    "Iran",
    "Russia"
  ]
}